<?xml version="1.0" encoding="UTF-8" ?>

<Chatbot 
	xmlns:xsi="http://www.w3.org/2001/XMLSchema-instance"
 xsi:noNamespaceSchemaLocation="schema.xsd" >

	<!-- LES PARAMETRES DU BOT -->
	<Settings>
		<Name>COA BOT</Name>
		<Birth>1980</Birth>
		<Company>
			<Name>Côte Ouest Audiovisuel</Name>
			<Birth>1980</Birth>
			<Ceo>Bernard Azria</Ceo>
		</Company>
		<Welcome>
			***************************************************************************
			*                                                                         *
			*           BIENVENU, COMMENT POUVONS-NOUS VOUS AIDER?                    *
			*                                                                         *
			***************************************************************************
		</Welcome>
		<Website>https://www.coteouest.tv</Website>
		<Version>1.0.0</Version>

		<Author>
			<Name>Zacharie A. Assagou</Name>
			<Address>
				<Emails>
					<Email type="personal">zakeszako@yahoo.fr</Email>
					<Email type="profesional">webmaster@coteouest.ci</Email>
				</Emails>

				<Phones>
					<Phone type="personal">+22571439414</Phone>
					<Phone type="profesional">+22522479613</Phone>
				</Phones>
				<Website>https://chatbot.io/about</Website>
			</Address>
		</Author>
	</Settings>
	
	<!-- LES QUESTIONS APPRISES -->
	<Questions>
		<Question>

			<Labels>
				<Label>Comment t'appelles-tu</Label>
				<Label>Comment tu t'appelles</Label>
				<Label>Comment vous appellez-vous</Label>
				<Label>Comment vous vous appellez</Label>
				
				<Label>Quel est {{ votre|ton }} nom</Label>
				<Label>{{ Votre|Ton }} nom</Label>
				<Label>Nom</Label>
			</Labels>

			<Responses>
				
				<Response>
					<Labels>
						<Label>{{ On|Je }} m'appelle __NAME__.</Label>
					</Labels>
				</Response>

				<Response>
					<Labels>
						<Label>Tu peux m'appeller __NAME__.</Label>
					</Labels>
				</Response>

				<Response>
					<Labels>
						<Label>Vous pouvez m'appeller __NAME__.</Label>
					</Labels>
				</Response>

				<Response>
					<Labels>
						<Label>Mon nom est __NAME__.</Label>
					</Labels>
				</Response>

				<Response>
					<Labels>
						<Label>Je m'appelle __NAME__ à l'Etat Civil.</Label>
					</Labels>
				</Response>

				<Response>
					<Labels>
						<Label>__NAME__ à l'Etat Civil.</Label>
					</Labels>
				</Response>

				<Response>
					<Labels>
						<Label>__NAME__ est mon nom.</Label>
					</Labels>
				</Response>

			</Responses>

		</Question>

		<Question>

			<Labels>
				<Label>Quel age as-tu</Label>
				<Label>Quel age avez-vous</Label>
				<Label>Quel est ton age</Label>
				<Label>ton age</Label>

				<Label>Quel es ta date de naissance</Label>
				<Label>Ta date de naissance</Label>
				<Label>Ton année de naissance</Label>
				<Label>Date de naissance</Label>
				
			</Labels>

			<Responses>

				<Proactivity>
					<Labels>
						<Label>je {{te|vous}} propose de parler de « __COMPANY_NAME__ »</Label>
						<Label>Et si {{vous|toi}} et moi parlions de « __COMPANY_NAME__ »</Label>
						<Label>Revenons à « __COMPANY_NAME__ » {{stp|svp}}.</Label>
						<Label>Parlons de « __COMPANY_NAME__ » {{stp|svp}}</Label>
					</Labels>
				</Proactivity>


				<Response>
					<Labels>
						<Label>je suis de __BIRTH__</Label>
					</Labels>
				</Response>

				<Response>
					<Labels>
						<Label>je suis né en __BIRTH__</Label>
					</Labels>
				</Response>


				<Response>
					<Labels>
						<Label>je suis né vers __BIRTH__</Label>
					</Labels>
				</Response>

			</Responses>
		</Question>


		<Question>
			<Labels>
				<Label>en quel année a été {{fondé|crée}} l'entreprise</Label>
				<Label>en quel année a été {{fondé|crée}} __COMPANY_NAME__</Label>
				<Label>date de création de __COMPANY_NAME__</Label>
				<Label>date de création de l'entreprise</Label>
				<Label>naissance de l'entreprise</Label>
				<Label>l'entreprise</Label>
				<Label>__COMPANY_NAME__</Label>
			</Labels>

			<Responses>

				<Response>
					<Labels>
						<Label>__COMPANY_NAME__ {{a été crée|existe|opère}} depuis 1993</Label>
					</Labels>
				</Response>

				<Response>
					<Labels>
						<Label>evidenment __COMPANY_NAME__ {{a été crée|existe|opère}} depuis 1993</Label>
					</Labels>
				</Response>

			</Responses>

		</Question>

		<Question>
			<Labels>
				<Label>qui dirige cette entreprise</Label>
				<Label>qui dirige __COMPANY_NAME__</Label>
				<Label>c'est qui le {{directeur|dg|pdg|ceo}}</Label>
				<Label>qui est le {{directeur|dg|pdg|ceo}} cette {{entreprise|boite}}</Label>
			</Labels>

			<Responses>

				<Response>
					<Labels>
						<Label>bien évidenment le CEO est __COMPANY_CEO__</Label>
					</Labels>
				</Response>

				<Response>
					<Labels>
						<Label>Le CEO est __COMPANY_CEO__</Label>
					</Labels>
				</Response>

				<Response>
					<Labels>
						<Label>Il {{se nomme|s'appelle}} __COMPANY_CEO__</Label>
					</Labels>
				</Response>
				
			</Responses>

		</Question>


		<Default>

			<Responses>
				
				<Response is-prefix="true">
					<Labels>
						<Label>Désolé, </Label>
					</Labels>
				</Response>

				<Response>
					<Labels>
						<Label>je ne comprends pas.</Label>
					</Labels>
				</Response>

				<Response>
					<Labels>
						<Label>pouvez-vous reformuler svp ?</Label>
					</Labels>
				</Response>

			</Responses>

		</Default>
	</Questions>
	
	<!-- LES QUESTIONS A APPRENDRE -->
	<Unknows>
		
	</Unknows>
</Chatbot>
